ID,Description,Entry_ID,Anthropology_Note,Grammar_Note,Scientific_Name,Sociolinguistics_Note
SN001293,"occur, speaking of a solar eclipse",LX000928,"This meaning only occurs in a single construction, <‘kásiiri ípɨɨtaki nunamija=jata,’> the literal meaning of which is ‘the moon fought with the sun,’ but the interpretation of which is ‘an eclipse occurred (last night).’ This expression reflects the traditional belief that a solar eclipse occurs when the moon, believed to be a cold, water-filled entity, attempts to overcome its rival, the sun; fortunately, this effort always fails, since were the moon to succeed, the world would be covered by a devastating flood",Note that the verb <ipɨráani> exhibits TAM marking appropriate to the temporal characteristics of the eclipse event,,
SN001294,"strike a blow, or carry out an attacking action, in the manner appropriate to implement used or the entity carrying out the action, e.g., for people, to hit with a fist or strike a blow with a spear; for biting animals, to deliver a bite",LX000929,,,,
SN001295,fight,LX000929,,,,
SN001296,an aggressive and violent person who tends to get into many fights,LX000930,,,,
SN001297,"‘ungurahui’, a species of palm that grows abundantly in elevated sandy soils and in swampy soils in low-lying areas. Its fruits, about 7cm long, are shaped like olives and have a brittle shell below which is a thin layer of purplish, oily flesh which in turn surrounds a large seed; the flesh is eaten by itself, or with manioc or farinha, or is made into a drink. Prized <[muusajákwaa](LX002061)> grubs thrive in the trunks of this palm, and the palm is felled both to promote the growth of the grubs and to collect them",LX000931,,,Jessenia bataua,
SN001298,"‘ungurahual’, grove of <[ipɨɨti](LX000931)> (‘ungurahui’) palms",LX000932,,"The final vowel of stem lengthens when followed by locative suffixes <-ku>, <-ma>, or <-kúura>",,
SN001299,"Amazonan Pygmy Owl, the smallest owl species in Iquito territory, measuring some 15cm in length, with a distinctive smooth, rounded head, and brown coloring except for its pale belly and it pale chest that is vertically streaked with brown",ipija,,,Glaucidium hardyi,
SN001300,"heated water, hot water",LX000933,,,,
SN001301,pour hot water over the skin of a dead animal in order to facilitate the removal of its fur or feathers by scraping the surface of the skin with a knife,LX000934,,,,
SN001302,"warm up a liquid to high temperature, but far short of boiling, e.g., when warming up soup to eat",LX000935,,,,
SN001303,bundle made by wrapping something in fabric and tying the opposite corners of the fabric together,LX000936,,,,
SN001304,"make a bundle using a leaf, piece of cloth or similar material, first laying the contents on the material, and then bringing the material together at a point and securing it by tying it, either with a piece of cord, or similar material, or by tying the opposite corners of the material together, to create a compact package",LX000937,,,,
SN001305,"wrap a person’s head in cloth; typically done for a person suffering from a fever, with the aim of protecting them from the air, which is considered dangerous at such times",LX000937,,,,
SN001306,"sit covered with a blanket or similar covering, either entirely covered, or with only one’s face showing; typically said of people with high fevers or who are otherwise unwell, and who are trying to stay warm",LX000938,,,,
SN001307,"fight; this term applies both to fighting with weapons, such as spears, or without, e.g., wrestling or fisticuffs",LX000939,,"The subject’s combatant(s) can be included as an oblique argument with the comitative postposition <=jata>. A plural subject typically, but defeasibly, yields a reciprocal interpretation, i.e., that the multiple participants denoted by the plural subject are fighting each other",,
SN001308,"internal digestive organ of fish; the first organ in which food arrives after being swallowed, having the shape of a wide tube",LX000940,,,,
SN001309,its wattle,LX000941,,,,
SN001310,his or her dewlap,LX000941,,,,
SN001311,"wattle or malar, the flap of skin, typically brightly colored, that hangs down from the chin to the throat of certain bird species, such as the <[paríiku](LX002465)> (‘pucacunga’) and the <[kaakáraaja](LX001342)> (chicken)",LX000942,,Poss.pref,,
SN001312,"dewlap, the loose fold or folds of skin that hang from the chin to the throat of older people and certain animals",LX000942,,Poss.pref,,
SN001313,"Dusky Titi, monkey species",LX000943,,,,
SN001314,"‘pucacuro’ or fire ant, species of reddish-brown ant 1-2mm in length, considered the smallest ant in Iquito territory. Despite its tiny size, it delivers a painful bite that can burn for a considerable time; generally found in large numbers, often nesting in the trunks of trees, they are considered a significant nuisance when they infest houses",LX000944,"According to Iquito oral tradition, they can be driven away by the application of electric eel grease to the posts of the house, or by placing chewed up manioc atop the house posts in each corner of the house",,Solenopsis sp,
SN001315,anaconda (of water),LX000945,,,,
SN001316,boil,LX000946,,,,
SN001317,"bubble, in the case of many bubbles emerging at the same time, as, for example, boiling water or a recently-opened soft drink",LX000946,,,,
SN001318,"take into one’s control a being or an object without constituent parts, e.g., an axe head or an empty basket, without specification of either the manner or the direction of any motion involved",LX000947,,,,
SN001319,"bubble, in the case that the bubbles emerge one after the other in small quantities",LX000948,,,,
SN001320,"move in a halting manner, or move by taking frequent detours, typically due to the need to work one’s way through an area in which movement is difficult because of obstacles of which one must free onself before advancing, e.g., walking through a dense area of forest; or, in a canoe, paddling through a part of the river that is thick with submerged logs",LX000949,,,,
SN001321,"haltingly, in a stop and start fashion",LX000950,,,,
SN001322,coccyx,LX000951,,Poss.pref,,
SN001323,"be snagged or stuck so as not to be able to move, e.g., be snagged on a branch while walking through the forest, or be stuck on the top of a submerged log when traveling by canoe along a waterway",LX000952,,,,
SN001324,"earthquake; earthquakes are sporadic in Iquito territory, with the last major one being in the late 1970s",irija,,,,
SN001325,"produce bubbles as the result of an action in the water, e.g., letting breath escape, struggling underwater, or disturbing the riverbed, which in many cases leads to the release of gases produced by vegetation trapped in sediment",LX000953,,,,
SN001326,"arrange or organize things, put things into order",LX000954,,,,
SN001327,fix or repair something that is damaged or is not functioning properly,LX000954,,,,
SN001328,"put oneself in order, fix oneself up, e.g., by neatening one’s hair, clothing, or makeup",LX000955,,,,
SN001329,"go to a side or corner of an enclosed space, leaving the central space clear",LX000956,,,,
SN001330,"break the foreskin of the penis; according to consultants, many Iquito men had tight foreskins that would tear painfully the first time they had sex, if they had not been deliberately torn beforehand",LX000957,,,,
SN001331,"break or tear, speaking of the foreskin of the penis",LX000958,,,,
SN001332,"break through, speaking of a river breaking through a thin stretch of land that separated two sections of its course, as in a place where a large curve in the waterway doubles back on itself. The outcomes of this breaking through are a shortcut in the waterway and an island; eventually, the large curve of the river that is no longer the main course of the river may become an oxbow lake",LX000959,,,,
SN001333,"side; a relative flat, vertically oriented surface that does not correspond to an intrinsic front or back of an entity, e.g. the side of a house, a cup, or a human body",irikuma,,the default form of this locative noun is <irikuma>,,
SN001334,"interior or exterior corner formed by two relatively flat surfaces joining at approximately right angles, e.g., two walls of a house, or the two edges of a table",LX000960,,Poss.pref,,
SN001335,its corner,LX000961,,,,
SN001336,"next to, at the side of; this postposition is reserved for grounds that have inherent orientations that distinguish a front and sides, with the postposition indicating that the figure is located in proximity to one of the sides of the ground, without specifying whether the figure is in contact with the ground or not",LX000962,,,,
SN001337,"the narrow side or flat edge of an object, in the case that the side is considerably shorter in one dimension than in the other, e.g., the narrow side or flat edge of plank, or the side of one’s torso",LX000963,,Poss.pref,,
SN001338,sister of male ego,LX000964,,Poss.pref,,
SN001339,his sister,LX000965,,,,
SN001340,his deceased sister,LX000966,,,,
SN001341,deceased sister of male ego,LX000967,,Poss.pref,,
SN001342,"garbage; relatively small and light detritus, such as leaves, manioc peelings, and fruit pits",iririka,,,,
SN001343,"garbage heap; traditionally garbage heaps were formed on a downslope near the house (e.g., leading to a creek), and were burned when the heaps became large; see also <[iririka](iririka)>",iririkajina,,,,
SN001344,"grow large in diameter, speaking of plantains",LX000968,,,,
SN001345,"menstruate for the first time, experience menarche",LX000969,,,,
SN001346,"savvy, astute, sufficiently worldly-wise not to be fooled or taken advantage of by others",LX000970,,,,
SN001347,"mature, speaking of plantains that have reached their full size, and are about to start ripening and turning yellow",LX000971,,,,
SN001348,harden,LX000972,,,,
SN001349,"hard, speaking of materials such as stone, metal, or wood",LX000973,,,,
SN001350,"immobile or difficult to move, either in the sense of being stiff, e.g., a hinge that does not turn easily or an inflexible rope; or of being rigid and secure, e.g., a well-secured house post that does not wobble",LX000973,,,,
SN001351,having experienced menstruation; this term is generally employed to indicate that a woman has reached reproductive age,irisiiti,,,,
SN001352,"take into one’s control an object with multiple constituent parts, e.g., an axe with a handle, a shotgun, or a basket full of manioc, without specification of either the manner or the direction of any motion involved",LX000974,,,,
SN001353,"take into one’s control a vessel in its inherent upright position, prototypically, with contents at the bottom of the vessel, e.g., a cooking pot with food in it, although it is not essential that the vessel have contents",LX000974,,,,
SN001354,"dip out or scoop out a liquid using a vessel, removing a smaller portion from a larger quantity of liquid",LX000974,,,,
SN001355,stepchild,LX000975,,Poss.pref,,
SN001356,"leave trace of one’s passage by crushing or breaking plants, e.g., by stepping on grass, or by forcing one’s way through thick growth in the forest",LX000976,,,,
SN001357,"abandoned residence site, referring specifically to the house and surrounding cleared area, where successional plants have invaded and the forest has started to regrow",LX000977,,Poss.pref,,
SN001358,"boil, make boil",LX000978,,,,
SN001359,"broad, flat, and relatively thin piece or part of something, e.g., a plank cut from a log, a slice of meat cut from a larger haunch, or a piece of fabric",LX000979,,,,
SN001360,plank or board,LX000979,,,,
SN001361,table,LX000979,,,,
SN001362,"remove a broad, flat, and relatively thin piece from a larger object, e.g., remove a slice of meat from a haunch",LX000980,,,,
SN001363,"deserted and silent, said of a dwelling and surrounding area whose inhabitants are absent, whether temporarily, due to, e.g., being on a long trip; or permanently, due to, e.g., having moved elsewhere, or having died",iriyaki,,"Despite functioning solely as an adjective, this root does not take the typical adjectival inflections for number (i.e., <-na>, <-mi>, <-pɨ>) and only takes the locative nominal inflections (i.e., <-ki>, <-ku>, <-ma>, <-kíira>)",,
SN001364,"a traditional nocturnal fishing method for catching predatory fish like <[páasi](LX002424)> (‘huasaco’), in which a lure made of feathers was used to agitate the surface of the water to attract the fish; this method was sometimes combined with chumming using fish guts",LX000981,,,,
SN001365,fishing pole,LX000982,,,,
SN001366,"‘shushupe jergón’ or Velvety Lancehead, species of highly venomous pit viper that reaches about 1.5m in length",LX000983,,,Bothrops brazili,
SN001367,"White-Winged Swallow, species of swallow, reaching some 13cm in length, that is usually found along rivers and lakes and is often seen perching on sticks and branches that emerge from the water. It has dark coloring, between dark blue-green and black, on its head, back, wings, and tail, while it throat, chest, belly, and sides are white",LX000984,,,Tachycineta albiventer,
SN001368,"‘paña muda’, species of piranha-like fish that reaches 20cm in length; grayish in color, it bears vertical stripes on its sides; found primarily in oxbow lakes, it is known for not making any sounds when hauled in with hook and line, unlike most similar fish, the characteristic from which derives its local Spanish name",LX000985,,,Serrasalmus sp,
SN001369,"<[Naamuutújuri](LX002103)> woman born in the 19th century, who lived in the Nanay River basin, dying in the late 1940s; she was feared for being a powerful <[siimana](siimana)> and numerous deaths among the Iquito population in the Nanay area were blamed on her witchcraft",LX000986,,,,
SN001370,urinate,LX000987,,,,
SN001371,"surroundings, space surrounding an object, e.g., a plant or house",LX000988,,The default form of this locative noun is <ísaku>. Poss.pref,,
SN001372,"his, her, or its bladder",LX000989,,,,
SN001373,bladder,LX000990,,Poss.pref,,
SN001374,"on the other side, directly across from the deictic center; indicates a point on the other side of a ground that is saliently long and narrow, and separates the space being discussed into two regions, e.g., a river or path; the point in question is located such that a line perpendicular to the edge of the ground, at the point at which the deictic center is located, passes both through the deictic center and the point on the other side of the river",LX000991,,,,
SN001375,"upriver of, where both the figure and ground are conceptualized as having minimal salient extension, i.e., are treated as being effectively point like, e.g., one house upriver of another",LX000992,,,,
SN001376,"above, at a greater vertical elevation, where both the figure and ground are conceptualized as having minimal salient extension, i.e., are treated as being effectively point like, e.g., an animal above one in a tree",LX000992,,,,
SN001377,a little bit upriver of; see <=isákuji 1>,LX000993,,,,
SN001378,"a little above, at a slightly higher elevation than; see <=isákuji 2>",LX000993,,,,
SN001379,"across, from one side of a broad space or object to the other, irrespective of contact with the object or space; this spatial relation holds for a log that lies across a creek, a narrow piece of cloth that lies across a table, or the trajectory of a bird that takes off from one side of a lake and flies across the lake to touch down on the other side",LX000994,,,,
SN001380,"pass by or go around something by deviating from a straight path and skirting it, e.g., pass a tree by going around its trunk on one side, skirting a lake by following its edge on one side, or going around a snake on a path",LX000995,,,,
SN001381,"‘tahuarí’ or ‘papelillo caspi’, species of tree that mainly grows in elevated areas with sandy soils; its trunk reaches up to 1.5m in diameter, and its bark can be easily removed in large whole pieces; this bark was traditionally used to make <[kimakɨ](LX001553)> (‘coshos’), large troughs for water or manioc beer; the bark was also used to make men’s modesty coverings and headdresses",LX000996,,,Tabebuia sp,
SN001382,"in the way of, obstructing, or cutting off; indicates spatial relationship of some figure relative to the deictic center and the ground such that the figure stands in the way of the ground relative to the deictic center, cutting off access (e.g., physical or visual) of someone at the deictic center to the ground, e.g., a fence that is in the way of walking to the door of a house, or a crowd of people gathered listening to a speaker that does not allow someone at the deictic center to see the speaker; often translated as ‘around’ or ‘in front of’",LX000997,,,,
SN001383,"around, both in the static spatial sense, e.g., a fence being around house, or trees being around a house, and in the dynamic spatial sense, e.g., a child running around a tree",LX000998,,,,
SN001384,"sugarcane, plant species",LX000999,,,,
SN001385,downriver of,LX001000,,,,
SN001386,"below, at a lower vertical elevation",LX001000,,,,
SN001387,a little downriver of; see see <=isámaji 1>,LX001001,,,,
SN001388,"slightly below, at a slightly lower elevation than; see <=isámaji 2>",LX001001,,,,
SN001389,"species of small lizard that reaches about 5cm in length and is common in houses and surrounding clearings in Iquito territory; covered in brown and gray mottling, they are excellent climbers",LX001002,,,Gonatodes sp,
SN001390,"woman who lived on the upper Pintuyacu River in approximately the mid-19th century, and sister to <[Riisamɨ́ɨni](LX002622)>, a man about whom a number of tales are told",LX001003,,,,
SN001391,Saddleback Tamarin (plural),LX001004,,,,
SN001392,"‘pichico’, Saddleback tamarin, a small monkey species; its flesh is esteemed for its taste",LX001005,,,Sanguinus fuscicollis,
SN001393,"‘pichico shimbillo’ or ‘pashaco de pichico’ species of tree whose trunk reaches some 1m in diameter, and is logged for timber; its ‘shimbillo’-like fruits, resembling large, flat, bean pods, cluster in small bunches, and contain a sweet, black, viscous, sticky substance that is a favorite food of marmosets",LX001006,,,Parkia igneiflora,
SN001394,"‘sarna’; general term for a type of skin malady that can spread to cover much of the body and can last for many years, causing significant itching. Until the introduction of antibiotics in the 1950s, a significant number of Iquitos were afflicted by this condition; in fact, mention of their particular susceptibility goes back to 18th century Jesuit chronicles. Iquitos distinguished three varieties of this condition, based on whether it manifested as a black, white, or red coloration of the skin, <[mɨɨ́nana isíiku](LX001916)>, <[musútina isíiku](LX002035)>, and <[aákusana isíiku](LX000062)>, respectively",LX001007,,,,
SN001395,person suffering from ‘sarna’,LX001007,,,,
SN001396,intimate friend,LX001008,,,,
SN001397,"the quality of being afflicted by <[isíiku](LX001007)> (‘sarna’), a skin malady that can cover large areas of a person’s body",LX001009,,,,
SN001398,"come to be afflicted with <[isíiku](LX001007)> (‘sarna’), a skin malady",LX001010,,,,
SN001399,make friends with another person,LX001011,,,,
SN001400,"‘pucahuicsa’, name employed for two similar species of ‘shuyo’ that live in leaf litter at the bottom of lakes and slow-moving, wide creeks. The first species is greenish in color, with a pale belly, and reaches some 15cm in length. The second, the ‘pucahuicasa’ proper, is yellowish, with reddish belly, and reaches some 25cm in length. Both species are characterized as being covered with a layer of slime unusual for scaled fish",LX001012,,,"Erythrinus erythrinus (‘pucahuicsa’ proper), Erythrinus sp. (other species)",
SN001401,cough,LX001013,,,,
SN001402,"an illness characterized by severe chronic cough that is called ‘asma’ in local Spanish; the described symptoms are consistent with tuberculosis or chronic bronchitis. Many Iquitos were afflicted by this condition until the 1960s and 1970s, when antibiotics became available",isija,,,,
SN001403,"‘asmoso’, a person who suffers from <[isija](isija)>, i.e., tuberculosis or chronic bronchitis, both of which are commonly called ‘asma’ locally",isijaati,,,,
SN001404,break a rope-like object in two pieces,LX001014,,,,
SN001405,"break in two, speaking of rope-like objects",LX001015,,,,
SN001406,"skin of a person, or skin or hide of an animal",LX001016,,Poss.pref,,
SN001407,tree bark,LX001016,,,,
SN001408,"rind, skin, or husk of a fruit or tuber",LX001016,,,,
SN001409,"shell, said of the integument of animals such as turtles, armadillos and <[waáyuuri](LX003463)> (‘carachamas’)",LX001016,,,,
SN001410,"his, her, or its skin",LX001017,,,,
SN001411,its bark,LX001017,,,,
SN001412,its rind,LX001017,,,,
SN001413,its shell,LX001017,,,,
SN001414,"dregs, residue; the material that remains after straining something, e.g., the residue of manioc beer mash, or after draining a beverage",LX001018,,Poss.pref,,
SN001415,its dregs,LX001019,,,,
SN001416,"make a popping, snapping, or cracking sound, e.g., as said of, respectively, popcorn, a breaking stick, or nearby lightning strike",LX001020,,,,
SN001417,"produce sounds of breaking branches and sticks, e.g., an animal moving through vegetation, or a tree falling",LX001021,,,,
SN001418,"deep, as said of vessels, holes, or bodies of water",LX001022,,"As with all adjectives, the root may take locative suffixes, however, for a distal point that is transverse to the direction of river flow, this root takes <-kíira>, not <-kúura>. Although <isíti-ki> (deep-proximal) and <isíti-ma> (deep-down) are used to characterize deep places, e.g., in rivers, speakers share a strong intuition that locations described with <isítima> are considerably deeper",,
SN001419,land (boat on shore),LX001023,,,,
SN001420,alight (bird),LX001023,,,,
SN001421,"make a concavity deep, e.g., when carving out the interior of a dugout canoe",LX001024,,,,
SN001422,"type of mat adopted by Iquitos in the early 20th century, as contact with ‘mestizos’ led them to abandon the use of hammocks to sleep in; the use of these mats then waned during the 1960s, when commercially-manufactured mats and mattresses became more common. These mats were made from lengths of dried, soft, pulp extracted from the cores of branches of ‘aguaje’ palms, which were woven into a lattice with lengths of balsa tree bark",LX001025,,,,
SN001423,"Gray-fronted Dove, species of dove reaching 27cm in length; its back, wings and tail are light brown, while its head, chest, and belly are gray-brown, with ruddy cheeks. Often encountered feeding on the ground, they spook easily and fly off noisily",isiwaaja,"According to Iquito oral tradition, its periodic hooting call stems from the fact that when it was human, it was notoriously lazy, and commonly begged out of making manioc beer by moaning and complaining of a tooth ache",,Leptotila rufaxilla,
SN001424,"ladder, steps",LX001026,,,,
SN001425,"‘victor día’, ‘bienteveo’, or Great Kiskadee, bird species that reaches 22cm in length, with yellow chest and belly, brown back, wings, and tail, horizontal black and white striping on the head, and a small yellow cap. This bird is commonly seen at forest edges, and its distinctive call is frequently heard, for which its Iquito name is an onomatopoeia; this species name is sometimes applied loosely to other similarly colored large flycatchers, such as the Lesser Kiskadee (Pitangus lictor)",LX001027,,,Pitangus sulphuratus,
SN001426,"‘ñejilla’, species of palm that is relatively short and slender, reaching 4-5m in height, with a trunk that reaches 10cm in diameter and has spines covering its trunk, branches, and leaves. This palm grows in areas which are inundated for much of the year, such as swamps or the edges of creeks and lakes, but specifically in areas where the flow of water is minimal, and it tends to form extensive groves in areas of standing water, which serve as a home for various species of fish, including the prized <[asúwaja](LX000568)> (‘bujurqui amarillo’). Its fruit, not edible to humans, is eaten by a variety of fish and by the <[mɨtiija](LX001978)>, ‘taricaya’ turtle",isunaaja,,,Bactris sp,
SN001427,"‘ñejillal’, grove of <[isunaaja](isunaaja)> (‘ñejilla’) palms, generally found in areas with shallow standing water",isunaajina,,,,
SN001428,"‘tigre zúngaro’, species of fish that grows to some 75cm in length, gray in color except for transverse black and white stripes on its flanks, and a white belly",isuuki,,,Pseudoplatystoma tigrinum,
SN001429,"‘maricahua’, plant with powerful hallucinogenic effects that was traditionally taken for shamanic purposes. With the use of this plant, shamans were reportedly able to cure illnesses and perform superhuman feats like flying to heaven and other lands. The plant was also the means by which shamans obtained their powers to heal or cause harm through witchcraft: the ‘madre’ of the plant would present the novice shaman, in a vision, a set of colored threads suspended in the air, each corresponding to a different ability; the apprentice would select the one corresponding to the ability he wished to aquire, and this thread would then enter his body through his mouth, conferring on him the desired power. The last shamans who knew how to use this plant are believed to have died in the late 19th century, so what we now know about its use is largely due to legends. This plant is understood to be the female counterpart of <[saasakíkwaa](LX002718)> (‘toé’), the former having white flowers, and the latter, purple",LX001028,,,Brugmansia sp,
