ID,Description,Entry_ID,Anthropology_Note,Grammar_Note,Scientific_Name,Sociolinguistics_Note
SN000001,"play a trick on someone, joke with someone by deceiving them or deliberately lying to them",LX000001,,,,
SN000002,play with,LX000001,,,,
SN000003,alone,yaajaa,,,,
SN000004,the.same,yaajaa,,,,
SN000005,thigh,LX000002,,Poss.pref,,
SN000006,leg,LX000002,,"In this sense, ‘thigh’ serves as a metonym for the entire limb. Poss.pref",,
SN000007,"his, her, or its thigh",LX000003,,,,
SN000008,"his, her, or its leg",LX000003,,,,
SN000009,vulva,LX000004,,Poss.pref,,
SN000010,"“OK!”, expression that anticipates an action or eventuality; generally indicates the speaker’s desire that the addressee carry out an action, either by themselves or as part of a group including the speaker; generally precedes a hortative or imperative utterance",aajaa,,,,
SN000011,insult a person verbally,LX000005,,,,
SN000012,"unproductive, speaking of plants, the quality of not producing edible fruits or tubers, despite being a member of a species that typically does produce them; less commonly, this term is also used to characterize plant species that produce fruits or tubers that not edible, especially when not even eaten by animals",LX000006,,,,
SN000013,"unsuccessful in hunting or fishing, speaking of a person, typically chronically so",LX000006,,,,
SN000014,negative existential verb; lack of existence or lack of presence in a relevant place is attributed to the single argument of the verb,LX000007,,"This negative existential verb exhibits some properties typical of locative nouns, in that <aájapa> may take the locative nominal suffixes <-ma>, <-ku>, and <-kúura>, with their expected spatial interpretations. Note, however, that the spatial sense of <-ki> has been bleached, such that <aájapaki> (< *<aájapa-ki>, presumably) has no proximal spatial interpretation, as would otherwise be expected from <-ki>",,
SN000015,"despite, although",LX000008,,,,
SN000016,"although, despite; this element expresses that an eventuality denoted by another clause, or otherwise present as knowledge in the common ground, obtains, or would obtain, despite the eventuality denoted by the clause in which this adverb appears; the other clause is often an immediately adjacent one, but need not be",LX000009,,,,
SN000017,"not do at all, not happen at all, or to the slightest degree",LX000010,,"In this sense, the negative existential verb takes a lexical verb derived with the event nominalizer as an argument; the resulting negation is emphatic in negating the possibility that the eventuality denoted by the nominalized verb is realized event to a slight degree",,
SN000018,remember or utter a person’s or a thing’s name; this verb can also be used metonymically to convey that one remembers the person more generally,LX000011,,,,
SN000019,"opening or mouth of a body of water, such as the mouth of a river or creek, where it joins a larger river as a tributary, or the mouth of an oxbow lake, where it connects to a waterway linked to the main river",LX000012,,Poss.pref,,
SN000020,"Mealy Parrot, species of large parrot that reaches some 40cm length; green except for some red on the wings and a yellow tail tip",LX000013,,,Amazona farinosa,
SN000021,its mouth (river),LX000014,,,,
SN000022,"grandson, son or daughter’s son, male or female ego, or great-grandson",LX000015,,Poss.pref,,
SN000023,his or her grandson,LX000016,,,,
SN000024,grandchildren,LX000017,,,,
SN000025,deceased grandson or great-grandson,LX000018,,Poss.pref,,
SN000026,his or her deceased grandson,LX000019,,,,
SN000027,his or her granddaughter,LX000020,,,,
SN000028,"granddaughter, son or daughter’s daughter, male or female ego, or great-granddaughter",LX000021,,Poss.pref,,
SN000029,deceased granddaughter or great-granddaughter,LX000022,,Poss.pref,,
SN000030,his or her deceased granddaughter,LX000023,,,,
SN000031,river,aaka,,,,
SN000032,water,aaka,,mass noun in this sense,,
SN000033,"watery sap, speaking of the sap of certain plants, such as <[arikamɨ́ɨna](LX000510)> (‘cumala de altura’), which is largely clear, and non-viscous",aaka,,mass noun in this sense,,
SN000034,honey,aaka,,mass noun in this sense; poss.pref,,
SN000035,"watery, typically said of a drink, such as manioc beer, when it has an excessive quantity of water in it",aakana,,,,
SN000036,"‘sábalo huayero’, species of silvery scaled fish that reaches some 30cm in length, with a longitudinal black stripe on its sides, towards the rear, that continues onto its tail, which is tinged red. Prized for its flesh, it is known for feeding on fruits that fall into the water in areas of flooded forest. Its Iquito name comes from the fact that it tends to swim close to the surface, revealing its presence by its wake",LX000024,,,Brycon hilarii,
SN000037,"‘pelejo de agua’ or Brown-throated Three-toed Sloth, species that reaches 80cm in length and 5.5kg in weight, with distinctive dark markings around the eyes that stretch back towards the ears. It is noted for its tendency to drop into water when disturbed and escape by swimming away",LX000025,,,Bradypus variegatus,
SN000038,"‘sharara’ or Anhinga, piscivorous bird species that reaches some 85cm in length, including its long tail. It is notable for its long, slender neck and its long, straight, sharply pointed bill. It is darkly colored except for its somewhat lighter neck and head and the straggly white feathers on the backs of its wings. Adept at swimming, it is typically found near water and is often seen perched on branches near the edges of bodies of water, drying its spread wings",LX000026,,,Anhinga anhinga,
SN000039,"‘yacu pato’ or Muscovy Duck, species of wild duck with dark plumage that reaches some 80-85cm in length",LX000027,,,Cairina moschata,
SN000040,"‘sencillo caspi’ or ‘plata pashaco’, tree species",LX000028,,,,
SN000041,"Sungrebe, bird species",LX000029,,,,
SN000042,"‘yacu jergón’, a term used for the Neotropical Water Snake and a number of similar species of patterned water snakes of a variety of colors, generally some 50cm length. Often encountered at river edges in masses of floating debris, such snakes are reported to be venomous, although Iquito individuals cannot recall any instances of bites that would substantiate this claim",aaka_sajina,,,Helicops spp,
SN000043,"‘quichatero’ or Zigzag Heron, small heron that reaches some 13cm, distinguished by its relatively short neck, hunched posture, and relatively dark, cryptic mottled coloring. It is noted for its tendency to defecate as it flies off when startled",LX000030,,,Zebrilus undulatus,
SN000044,"‘piojo del agua’, general term for a wide range of small aquatic insects, including Water Striders, which skim along the surface of the water; and Back Swimmers and Water Boatmen, which swim beneath the surface. Traditionally, Iquitos believed that drinking water in which these insects were abundant could be dangerous, as some species were believed to lodge in the throat and deprive one of the ability to speak",aaka_sikwanaja,,,"Gerridae spp., Notonectidae spp., Corixidae spp",
SN000045,"‘huapeta’, species of edible predatory fish that reaches some 40cm in length. Its body is strikingly flat for its length and is covered in silvery scales. It is most notable for its large head, and the pair of sharp, fang-like teeth that protrude from its lower jaw, which measure up to 4cm in length",aakaari,,,Hydrolycus scomberoides,
SN000046,"‘huapetero’, fishing line and hook made for catching <[aakaari](aakaari)> (‘huapeta’) fish",LX000031,,,,
SN000047,Amazonian Manatee,LX000032,,,,
SN000048,"‘vaca marina’ or Amazonian Manatee, large aquatic mammal that can reach almost 3m in length and up to 500kg in weight; always rare in Pintuyacu River basin, they were relatively abundant in oxbow lakes in the neighboring Nanay River region until they were essentially wiped out by hunting by the mid-20th century",LX000033,,,Trichechus inunguis,
SN000049,"type of fan woven from the immature buds of <[niraasi](niraasi)> (‘shapaja’) palms with a distinctive rounded shape resembling a manatee tail, less commonly made than the <[apíraati](LX000464)>",LX000034,,,,
SN000050,"variety of small edible passion fruit, reaching 6cm in diameter, of a dark color, almost black, similar to a manatee’s (<[aakáayɨ](LX000033)>) hide",LX000035,,,Passiflora sp,
SN000051,"‘Quebrada Acamana’, a small tributary of the Pintuyacu River, located some two hours upriver by paddle from the confluence of the Pintuyacu and Chambira Rivers, on the same side of the river as San Antonio; a settlement was founded on this creek, a short distance upriver from its mouth, in about 1910, and endured until the mid-1960s, when the last of its residents passed away",LX000036,,,,
SN000052,"glossy or shiny, e.g., a new piece of ceramic tile, polished wood, a mirror, or hair with pomade in it",LX000037,,,,
SN000053,"smooth, speaking of the surface of an object, such as a well-made cement floor or the top of a plastic table",LX000037,,,,
SN000054,"make a surface smooth, e.g., by removing surface irregularities from piece of wood using a plane or machete, or smoothing the clay of an unfired piece of pottery using water and a piece of manioc peel",LX000038,,,,
SN000055,open one’s mouth,LX000039,,,,
SN000056,"make something watery by adding water to it, whether diluting a liquid, such as manioc beer, or wetting something dry, such as ‘fariña’, to which water is often added to soften the hard, dry meal",LX000040,,,,
SN000057,now,LX000041,,,,
SN000058,today,LX000041,,,,
SN000059,"baptize, as carried out by a Catholic priest",LX000042,,,,
SN000060,"bail, remove water from a canoe or similarly large object or feature, e.g., a wall, by repeatedly scooping out water using a small vessel",LX000043,,,,
SN000061,"form a subcutaneous head, speaking of a skin abscess or similar subcutaneous accumulation of matter as it approaches rupturing by bulging at the surface of the skin and forming a head where the matter in question is clearly visible beneath the surface of the skin",LX000044,,,,
SN000062,"‘leñero’ or ‘leñatero’, larval stage of one or more bagworm moth species, notable for constructing a case made of twigs, in which it spends most of its time. The case has the form of a long, tapering, pyramidal shape that reaches some 7cm in length and is 3cm wide at its base. When this creature changes locations, it can be seen pulling this shelter behind it",LX000045,,,Psychidae spp,
SN000063,pus,LX000046,,,,
SN000064,"be drunk or intoxicated, whether by alcohol or by another psychoactive substance, such as <[aákuta](LX000067)> (ayahuasca)",LX000047,,"In this sense, the intoxicating substance can be optionally indicated with an NP bearing the instrumental postposition <=jata>",,
SN000065,be intoxicated by something,LX000048,,"In this sense, the subject denotes the intoxicated party, and the object the intoxicating substance",,
SN000066,get someone drunk,LX000049,,,,
SN000067,variety of <[mɨɨ́mɨɨti](LX001912)> (‘chacruna’) used in the preparation of <[aákuta](LX000067)> (‘ayahuasca’); this variety is reported to induce particularly strong hallucinations in which dangerous creatures such as boas are especially prominent,LX000050,,,Psychotria viridis var,
SN000068,be or get drunk on multiple occasions in a relatively short interval of time,LX000051,,,,
SN000069,"‘sábalo huayero’, fish species",LX000052,,,,
SN000070,"empty shell, husk, or similar concavity, e.g., the shell of a turtle, an eggshell, a pineapple that has had its middle eaten out, or the curved dried petiole, or stem, of a palm frond (‘ropoca’)",LX000053,,Poss.pref,,
SN000071,its empty shell,LX000054,,,,
SN000072,"because of, or due to",LX000055,,The complement of this postposition denotes or indexes the reason for which the eventuality denoted by the associated verb is realized,,
SN000073,"in front of, spatially",LX000056,,,,
SN000074,"before, prior in a temporal sequence",LX000056,,,,
SN000075,"older male relative, irrespective of gender of ego; the reference of this term term is restricted to either relatives which address each other with reciprocal kinship terms, such as brothers, or cousins, or sufficiently distant relatives such that no more specific kinship term obtains",LX000057,,Poss.pref,,
SN000076,elder male relative (plural),LX000058,,,,
SN000077,elder female relative (plural),LX000058,,,,
SN000078,"older female relative, irrespective of gender of ego; this term is restricted to either relatives who address each other with reciprocal kinship terms, such as sisters, or cousins, or sufficiently distant relatives such that no more specific kinship term obtains",LX000059,,Poss.pref,,
SN000079,"a term which denotes a range of colors for which fire-engine red is focal, but extends to include shades of orange and reddish brown",LX000060,,,,
SN000080,"ripe, speaking of fruits such as plantains, cashews, passion fruits, pineapples, and others that turn yellowish or reddish when ripe",LX000060,,,,
SN000081,"‘isango’, a tiny orange-red parasitical chigger, the larval stage of a number of species of mites. Barely visible to the naked eye, these creatures await passing hosts on plants, and on blades of grass in particular. On contact, they climb up the host’s body to a crease of the skin such as an arm pit or, in the case of humans, a place where clothing is tight against the skin, e.g., the area near the waistband. Once in a suitable location, they insert their mouthparts into the host’s skin to feed, causing significant itching and redness, which can be calmed by removing the creature with a needle",LX000061,,,Eutrombicula spp,
SN000082,"‘sarna colorada’ or ringworm, a skin fungus which begins as a small red spot on some part of the body and grows, forming an expanding ring of red, irritated, itchy skin. Traditionally, this affliction was treated with leaves of <[aapaanaamɨ](LX000109)> (‘sacha penicilina’), which were soaked in urine until they turned black, and then applied to the itching area",LX000062,,,,
SN000083,"‘ichichimi colorado’, ant species similar to the ‘true’ ‘ichichimi’ (i.e., ‘ichichimi negro’), but distinguished from them in being yellowish-brown in color, in having an extremely painful bite, and in the form of its nest, which resembles a ball of spiderweb-like material about 50cm diameter; when squeezed, the nest emits a sharp, acrid smell, which was considered especially effective in treatments intended to improve the hunting abilities of dogs (see <[masakana](masakana)>)",LX000063,,,Dolichoderus sp,
SN000084,"‘venado colorado’ or Red Brocket Deer, deer species with chestnut-red coloring that grows to some 1.4m in length and almost 50kg in weight; the males grow short, straight, unbranched anters that are directed backwards",LX000064,,,Mazama americana,
SN000085,"begin to ripen, speaking of the stage at which a fruit starts to become ripe but is not yet fully ripe, said of fruits that turn yellow or red when ripe",LX000065,,,,
SN000086,"species of ‘tangarana’-type tree notable for its bark, which peels up in scale-like patches before eventually dropping off, giving the trunk an almost feathered appearance; it grows in inundating areas near rivers, reaching 1.25m in diameter. Its yellow wood is valued as a source of planks, and its commercial harvesting in past decades means that it is now very rarely encountered. When young and relatively slender, it is home to biting ants, like other ‘tangaranas’ (e.g., <[tamɨ́ɨna](LX003224)>)",LX000066,,,,
SN000087,"‘ayahuasca’, cultivated plant that constitutes one of the principal ingredients in the hallucinogenic brew of the same name. The plant itself is a woody creeper that grows up from the ground, and is typically harvested when it reaches a diameter of several centimeters",LX000067,,,Banisteriopsis caapi,
SN000088,"‘ayahuasca’, hallucinogenic beverage made from the woody creeper of the same name and <[mɨɨ́mɨɨti](LX001912)> (‘chacruna’) leaves, among other possible additional ingredients. In traditional Iquito society, this beverage was reportedly consumed periodically by all adults, in contrast to <[isúuna](LX001028)> and <[saasakíkwaa](LX002718)>, hallucinogenic plants of great power which were only used by shamans. Iquito elders explain that their ancestors took ‘ayahuasca’ for a variety of purposes, including treating illness, removing bad luck, divination (e.g., finding lost items or identifying a thief), and obtaining knowledge or skill related to important subsistence activities, such as farming or hunting",LX000067,,,,
SN000089,"unidentified plant whose long, thick tubers were added to <[aákuta](LX000067)> (‘ayahuasca’) to sweeten the beverage; the tuber was typically cut transversely into disks, which were strung on a loop of <[núriyɨ](LX002367)> (‘tamshi’ vine), so that they could be easily removed once the concoction was done cooking",LX000068,,,,
SN000090,"make a batch of manioc beer for a social event, especially for a ‘minga’ or work party",LX000069,,"The verbal object is the event for which the manioc beer is made, e.g., <natɨ́yaaka>, a planting ‘minga’",,
SN000091,"contribute food or drink of any type to a social event, especially a celebration or a ‘minga’",LX000069,,"The verbal object is the event to which the contribution is made, e.g., <natɨ́yaaka>, a planting ‘minga’",,
SN000092,cooked manioc intended for consumption as food (as opposed to cooked manioc destined for manioc beer),LX000070,,,,
SN000093,"prepare manioc intended to be consumed as food (as opposed to being made into manioc beer), referring to the entire process, from peeling and washing the manioc tubers, through cutting them and cooking them",LX000071,,,,
SN000094,cousin; vocative term used to address one’s cousin,aakuuna,,Referential counterpart: <kuuna>,,
SN000095,cousin (affectionate vocative form),LX000072,,,,
SN000096,"‘añashúa’-type species of fish found in small creeks. It reaches some 20cm in length and is bluish-gray in color, with small yellow spots on its belly and a white fringe on its tail",LX000073,,,,
SN000097,"construct an <aamaákuuja>, a hunting platform",LX000074,,,,
SN000098,"construct the frame for a house, including placing the house posts in the ground, as well as building the roof frame on the top of the structure",LX000075,,"In this sense, the verb must take an NP object that refers to the house for which a frame is being constructed",,
SN000099,"temporary platform constructed between the branches of a tree to allow a hunter to lie in wait for passing animals; such platforms are typically constructed in fruiting trees, in order to permit the hunter to fire at animals who approach the base of the tree to eat fallen fruits",LX000076,,,,
SN000100,"house frame; the set of large timbers, consisting of the main wall posts and roof poles, that give a house is structure and strength",LX000076,,,,
SN000101,"‘airambo’ or Venezuelan Pokeweed, a bushy plant that grows to some 2m in height and is principally found in ‘purmas’ that are at an early stage of reverting to forest. The plant produces stalks near its crown on which grow berries that turn dark purple when ripe, and are avidly consumed by birds; these same berries were traditionally harvested as bait for small fish, and were used to dye <[kanuu](kanuu)> (‘chambira’ fiber). The leaves were also cooked to make <[siwɨɨka](LX003096)>, a traditional dish",LX000077,,,Phytolacca rivinoides,
SN000102,"yesterday or tomorrow; one day distant from today, with the specific temporal interpretation fixed either by the tense of the clause or by discursive context",LX000078,,,,
SN000103,"yesterday’s, from yesterday, of yesterday, e.g., yesterday’s meat, or a person born yesterday",LX000079,,,,
SN000104,"‘huito’ or ‘jagua’, tree species whose fruits are sweet and edible when ripe, but which is best known as the source of a black pigment used to decorate the skin or to dye <[kanuu](kanuu)> (‘chambira’ palm fibers) for spinning into cord for hammocks and other woven products; the leaves are sometimes made into a tea to treat colic",aamina,,,Genipa americana,
SN000105,‘huito’ (plural),aaminaari,,,,
SN000106,"wander, walk about, or travel around without a fixed destination, typically stopping at various points on one’s trajectory",LX000080,,,,
SN000107,"go hunting, typically in the forest",LX000080,,,,
SN000108,"travel a great distance, typically to a previously unknown destination",LX000080,,,,
SN000109,"walk or pace back and forth in a space, e.g., in a house",LX000081,,,,
SN000110,kill,LX000082,,,,
SN000111,"hit or strike a living being, be it with a body part, or with an instrument",LX000082,,"If a body part is struck, its corresponding NP typically takes the locative postpostion general locative postposition <=jina>",,
SN000112,"hit an inanimate object with or without an implement, e.g., hitting one’s hand against a table, or hitting something with a stick, including, e.g., hitting a drum with a stick",LX000082,,"In this sense, the verbal object does not take a locative postposition",,
SN000113,"pound or pulp certain plants in order that they be usable, e.g., <[tatɨɨ](LX003277)> (‘cashapona’) palm trunks, which must be pounded so that the exterior part splits up into laths that can be used for floors or walls; or <[miríjaaja](LX001971)> (‘mishquipanga’) fruits, which must be pounded to split them and remove their seeds; or <[nuúruu](LX002381)> (‘barbasco’), which must be pulped to release its fish-incapacitating fluid",LX000082,,"In this sense, the verbal object does not take a locative postposition",,
SN000114,"variety of <[mɨɨ́mɨɨti](LX001912)> (‘chacruna’) which was traditionally used to ready warriors for war; warriors would rub the leaves on their spears and their body, as well as chewing a small portion, so that they would feel rage towards the enemy and not experience fear in combat. The leaves were also used as an ingredient in <[aákuta](LX000067)> (‘ayahuasca’) to induce visions of warfare",LX000083,,,Psychotria viridis var,
SN000115,"flap or beat wings, said of birds who flap at a relatively slow pace",LX000084,,The verb takes an NP complement that refers to the wings as the verbal object,,
SN000116,"beat or strike something against a surface, such as a wall, or the ground",LX000085,,The verbal object the thing stuck; the surface against which it is struck is optionally introduced as a postpositional phrase,,
SN000117,pestle or mallet used for pounding or pulping food or ‘barbasco’,LX000086,,,,
SN000118,"species of ‘shimbillo’-type tree that is typically found on the banks of oxbow lakes; its fruits are some 15-20cm long and flat in comparison to their width; it is believed that the seeds of this species of ‘shimbillo’, if eaten when the fruits are consumed, pose a significant danger of intestinal blockage, which can reputedly be fatal",LX000087,,,Inga sp,
SN000119,cross river or other body of water by boat,LX000088,,The object of the verb is the body of water crossed by the subject of the verb,,
SN000120,Iquito subgroup of the Nanay River region,LX000089,,,,
SN000121,"‘Cahuarano’, an ethnic group speaking a language mutually intelligible with Iquito but considered distinct, at least in part due to the fact that Iquitos considered the <[Aámuuwáaja](LX000090)> a nomadic people who did not practice agriculture. They lived at the headwaters of the Nanay and Pintuyacu Rivers, and were occasionally captured by Iquitos when they encountered them, and were brought to Iquito settlements to work as servants, where they eventually intermarried with Iquitos if they survived. The last capture of Aámuuwáaja individuals occurred in the 1920s or 1930s, and they have not been seen since",LX000090,,,,
SN000122,"general term for dolphin, including both the Pink River Dolphin (<aana aákusana>) and the Gray Dolphin (<aana mɨɨ́nana>). As in many parts of Amazonia, there are many beliefs among the Iquito people concerning the Pink River Dolphin, including that it is a shamanic creature who can attack people in the river and who can use magical powers to harm people who mock it",aana,,,"Inia geoffrensis ({\ iqt aana ákusana}), Sotalia fluviatilis (<aana mɨɨ́nana>)","JPI does not exhibit a possessed/non-possessed alternation for this root, neutralizing in favor of the non-possessed form, <[aana](aana)>"
SN000123,"‘bufeo shimbillo’, tree species",LX000091,,,,
SN000124,"‘lisa yulilla’, species of silvery ‘lisa’-type fish, with multiple transverse dark stripes, that reaches some 40cm length. It is appreciated for its soft and watery, but quite tasty, flesh",LX000092,,,Schizodon sp,
SN000125,"‘bufeo cunchi’, species of pale ‘cunchi’-type fish that reaches 10cm in length and has a distinctive slender snout, which is said to resemble a dolphin’s snout, inspiring its name. It also has long feelers around its mouth and short pointed spurs, similar to those found on <[kuyúkuyu](LX001720)> (‘turushuqui’), running lengthwise down the middle of each its sides",LX000093,,,,
SN000126,"‘bufeo shimbillo’, species of small ‘shimbillo’-type tree that grows to some 3m in height, and typically grows right at the water’s edge, with its branches extended over the water. Its fruits, which reach some 10cm in length, are long and slender, like those of most ‘shimbillos’, but are arced in a manner considered similar to the back of a dolphin, from which its Iquito name stems. Because its seeds are bitter, care is taken when eating the sweet flesh, typical of ‘shimbillos’, that surrounds them",LX000094,,,Inga sp,
SN000127,archaic vocative term for male sibling of female ego,LX000095,,,,
