ID,Description,Entry_ID,Anthropology_Note,Grammar_Note,Scientific_Name,Sociolinguistics_Note
SN002486,"Black Hawk-Eagle, a species of large raptor encountered in the forest and near forest edges, that reaches 65cm in height. It is generally black, except for its belly and vent, which have fine pale horizontal stripes, and its tail and the underside of its wings, which have broader pale bands",LX001806,"According to Iquito oral tradition, this eagle was once an old woman who had never succeeded in raising her own children past childhood, and who would lure away and play with other people’s children, over the years eventually transforming into this raptor. It was therefore believed that this eagle was an evil spirit who would take the souls of children if it could, so when it was sighted, or more commonly, when its call was heard, adults would mark the tips of the noses of any nearby children with charcoal, which was believed to protect their spirits from this threat",,Spizaetus tyrannus,
SN002487,"whip, strike something relatively flexible against something else",LX001807,,,,
SN002488,"clear a young <[mákisi](LX001843)> (‘purma’, fallow swidden) by swiftly felling the saplings and undergrowth with a machete, in contrast to the much more protracted process of clearing an area of more established forest, which requires felling trees with an axe",LX001807,,,,
SN002489,"give an electric shock, speaking of electric eels",LX001807,,This sense typically takes takes the momentary perfective <-rɨɨ>,,
SN002490,"raw or uncooked, speaking of meat, fish, or plant matter foods",LX001808,,,,
SN002491,blood,LX001809,,mass noun,,
SN002492,bleed,LX001810,,The subject of the verb may either be the person or animal who is bleeding or the body part or injury that is bleeding,,
SN002493,"wife, referential term",LX001811,,Vocative counterpart: <wíija>. Poss.pref,,
SN002494,wife (plural),LX001812,,,,
SN002495,deceased wife,LX001813,,Poss.pref,,
SN002496,"whip or cast a fishing rod forward so as to flick its attached line, weight and hook out into the water",LX001814,,,,
SN002497,whip or lash,LX001815,,,,
SN002498,"repeatedly cast fishing line and hook into water, a fishing technique effective for certain types of fish",LX001816,,,,
SN002499,throw an opponent to the ground repeatedly while fighting,LX001817,,,,
SN002500,"general term for small fishes (typically 10cm or less, and often much less) of a wide variety of species, including some species that can grow to large sizes and other species that remain small. Such fish are typically encountered in small creeks, typically captured using <[nuúruu](LX002381)> (‘barbasco’, fish poison) and typically prepared and consumed in the form of <[kunitaaka](kunitaaka)>, smoked ‘patarashca’",LX001818,,,,
SN002501,"bee larva. Among the species that Iquitos are familiar with, the larvae are housed in a layer of cells filled with royal jelly found below the section of the hive occupied by honey-holding cells",LX001819,,Poss.pref.; the possessor is the hive to which the larva belongs,,
SN002502,"suffer a miscarriage or spontaneous abortion. Iquitos consider miscarriages to be due typically either to an injury suffered by the mother (e.g., a fall or physical abuse) or an illness suffered by her, but also attribute them to the mother being unable to satisfy food cravings",LX001820,,,,
SN002503,"‘charichuelo’, tree species that grows in a variety of environments and reaches up to 1.5m in diameter. It is best known for its edible round yellow fruits, about 6-8cm in diameter, which have a thick rind that holds 2 or 3 seeds covered with sweet flesh; the fruits are eaten by a variety of monkeys and, when they fall to the ground, by Pacas (<[tiímaaka](LX003307)>), but they are not often harvested, since the tree must be felled to obtain them",majuu,,,Garcinia macrophylla,
SN002504,"Short-tailed Nighthawk, species of dark-colored insectivorous bird seen at dusk and often mistaken for a bat due its body shape and flight habits",LX001821,,,Lurocalis semitorquatus,
SN002505,"‘chambira’ cord bundle, a method of storing chambira cord that kinks it less severely than simply winding it into a ball. A rod-like core is first made by coiling the cord around a loop that has been collapsed into a length that serves as the core; once the rod-like shape is relatively rigid, the remaining cord is wrapped lengthwise on the rod in a figure-eight pattern, with the extrema of the figure-eight anchored against the ends of the rod",LX001822,,,,
SN002506,"‘macambo’, a cultivated tree species introduced to Iquito territory in the early 20th century. Its large fruits, which reach some 30cm in length, resemble cacao fruits but with more rounded ends, and its somewhat sweet flesh surrounds large edible seeds, which are typically roasted or fried before eating",LX001823,,,Theobroma bicolor,
SN002507,reverse (cord-spinning),makajaya,,,,
SN002508,"unripe or not fully mature, speaking of cultigens, e.g., <[asúraaja](LX000561)> (manioc), <[amariyaaja](amariyaaja)> (‘pijuayo’), <[samúkwaati](LX002771)> (plantain), or <[támuu](LX003232)> (‘guaba’) fruits",makina,,,,
SN002509,sleep,LX001824,,,,
SN002510,"go on a multi-day hunting or fishing trip, with at least one night spent sleeping away from home",LX001824,,"In this sense, the verb appears in its event-nominalized form as an adjunct to <iwáani> ‘go’ and bears the postposition <=ánuura>",,
SN002511,"sit fermenting, said of manioc beer mash",LX001824,,,,
SN002512,dream,LX001825,,,,
SN002513,"go out or extinguish itself, speaking of a flame source such as a cooking fire or a candle",LX001826,,,,
SN002514,"for the sun to dim, for sunlight to diminish and become less strong, e.g., due to clouds",LX001826,,This sense requires inceptive aspect <-aárɨɨ>,,
SN002515,"put out flame source, such as a cooking fire or a kerosene lamp",LX001827,,,,
SN002516,"turn off electrical aparatus, e.g., lightbulb or radio",LX001827,,,,
SN002517,crab (general term),LX001828,,,,
SN002518,"mosquito net, adopted by Iquito people in the early 20th century",LX001829,,,,
SN002519,sleeping place; see also <[makɨ́ɨni](LX001824)>,LX001830,,Poss.pref,,
SN002520,"in one’s sleep, while sleeping",LX001831,,The fact that this element bears a possessive marker but does not require a postpositional licenser suggests that it has some of the grammatical properties of a locative noun,,
SN002521,dream,LX001832,,,,
SN002522,sleepy,LX001833,,"This adjective is only known to appear with inflected forms of <iwíini>, e.g., <makɨɨníita k=iíkii>, ‘I’m sleepy’",,
SN002523,"bedding, protoypically sheets or blankets",LX001834,,,,
SN002524,"‘hierba dormilón’, species of plant with small leaves that react, closing in on themselves, when touched. This plant was traditionally used by Iquitos to cure excessive crying in young children by burning its leaves under the child, so it is enveloped by the smoke; the bones of ‘huasaco’ (<[páasi](LX002424)>) were sometimes burned with the leaves as part of the treatment",LX001835,,,Mimosa pudica,
SN002525,"backwards or reverse, specifically in the case of spinning cord (<[iníini](LX000892)>), especially ‘chambira’ cord (<[iniyɨ](LX000914)>); instead of the principal spinning gesture being away from the body, the gesture is directed towards the body, resulting in cord with left-handed, rather than right-handed chirality; the resulting backwards-spun cord is considered by some to be prettier than normally spun cord, although it is more difficult to make",LX001836,,,,
SN002526,"harvest manioc for the first time from a relatively recently planted garden, typically some 6 months after planting; traditionally the woman who owned the garden would invite other women to join her on this occasion, harvesting a large quantity of manioc to make substantial batch of manioc beer which friends and neighbors were invited to drink",LX001837,,,,
SN002527,"immature manioc tubers that have grown sufficiently that they can be harvested and cooked, but have not yet reached their full size; these tubers are much softer than ther mature counterparts, and are generally only harvested when mature manioc is not available",makika,,,,
SN002528,"‘obero’, ‘sarna blanca’, or vitiligo, a skin malady in which pale, depigmented patches appear on the body; these patches neither hurt not itch. It was traditionally believed that this malady was caused by failing to follow dietary restrictions associated with the consumption of <[aákuta](LX000067)> (‘ayahuasca’)",LX001838,,,,
SN002529,new moon; the extremely slender very first phase of the moon,LX001839,,,,
SN002530,"sleeping place; this term is generally applied to regular sleeping places, such as one’s bed, or places at which one regularly sleeps on hunting and fishing trips, where one may have built shelters",LX001840,,Poss.pref,,
SN002531,"area in the process of being colonized by riverside successional plants; in Iquito territory these are typically the low, sandy areas on the interior side of river bends, with the primary successional species being <[asinaja](asinaja)> (‘pumapanga’), <[tamɨ́ɨna](LX003224)> (‘tangarana’), and a number of lianas",LX001841,,,,
SN002532,"a riverside or forest site regularly used as a place to sleep, often involving the construction of temporary shelters, i.e.<[mɨyiti](LX002003)> (‘tambos’), by fishermen and hunters on fishing and hunting trips that take them away from their homes for many days at a time; see also <[makɨ́ɨni](LX001824)>",LX001842,,,,
SN002533,"‘purma’, a <[nasi](nasi)> (‘chacra’, swidden) whose crops have been mostly or entirely harvested, and that is in the process of reverting to secondary forest",LX001843,,,,
SN002534,"‘purma shimbillo’, species of ‘shimbillo’-type tree that grows in ‘purmas’ and in clayey-soiled forests. Its flat pods contain seeds about 1cm diameter, arranged longitudinally in the pod and surrounded by very sweet flesh, with flat fleshless segments between the seeds. Formerly abundant in the San Antonio area, this species is now rare due to the practice of felling the tree for its fruits",LX001844,,,Inga sp,
SN002535,"‘pichirina’, term applied to two similar species of trees, one that grows in inundating areas and on river banks, with broad leaves and rough brown bark, and another that grows in elevated areas, especially in ‘purmas’, with small leaves with smooth bark. The former species reaches a diameter of 40cm and is used for roof poles, while the latter does not grow large enough for this purpose; both species produce a thick yellow sap that is used to treat certain types of skin fungus",LX001845,,,Vismia spp,
SN002536,close eyes,LX001846,,,,
SN002537,"blink repeatedly in a strong manner, generally as a nervous tic, but also in cases when something is irritating the eye",LX001847,,,,
SN002538,"a small creek located a few kilometers downriver of the community of San Antonio, and on the same side of the river; its source is an ‘aguajal’, and according to Iquito oral tradition, it had a small Iquito settlement along its banks in the late 19th century; being very small, this creek was never given a Spanish name, although its Iquito name could be faithfully glossed as ‘Purma Quebrada’",LX001848,,,,
SN002539,"harvest young, not fully grown manioc tubers, typically from a relatively recently planted garden in which the plants have not yet had time to mature",LX001849,,,,
SN002540,harvest unripe fruits,LX001849,,,,
SN002541,"‘macusari’, species of slender, extremely spicy pepper, up to 8cm in length, that turns red when ripe. Formerly a critical ingredient in <[jikuriáaka](LX001247)> or manioc stew, it is now rarely cultivated. Apart from its use as a condiment, this pepper played an important role in the <[kajíini](LX001381)> menarche celebration, when the celebrated young woman had the pulped flesh of this pepper applied to her teeth and gums to assure that her teeth remain healthy and without cavities. This pepper was also rubbed on the nose and snouts of dogs to make them better hunters",LX001850,,,Capsicum sp,
SN002542,species of leafcutter ant that makes its nest out of leaf litter in the notches of trees and is known for cutting clothing to pieces in order to carry it off,LX001851,,,Acromyrmex sp,
SN002543,"‘asna charapa’, species of edible aquatic turtle whose shell is similar in color and shape to that of the better known <[mɨtiija](LX001978)> (‘taricaya’), but issomewhat more domed and about some 30cm in length. Its relatively large head has yellow markings near the base of its jaws. The name of this species stems from its habit of preying on <[anitáaki makwaati](LX000438)> (‘huangana sapo’) toads during their egg-laying season",LX001852,,,Phrynops sp,
SN002544,"general term for anurans, i.e., toads and frogs",makwaati,,,,
SN002545,"species of ‘mojarra’-type fish that lives in creeks and lakes with very still water. Its flat body reaches some 10cm in length and some 2-3cm in width. Silvery in color and with thick scales, it has a single black spot on its tail, and is distinctive for its eyes being red around its pupils. This fish is considered especially tasty when cooked in large numbers in <[ijiika](ijiika)> (‘patarashcas’)",mamatiiri,,,,
SN002546,"pregnant, speaking of both humans and animals",manaja,,,,
SN002547,become pregnant,LX001853,,The subject is obligatorily feminine,,
SN002548,impregnate,LX001854,,The subject is obligatorily masculine,,
SN002549,"bother or harrass someone deliberately, typically by critizing or taunting them, or by pressing a request beyond its appropriate point",LX001855,,,,
SN002550,"bother, obstruct, or distract, speaking of objects and states, such as illness or injury",LX001855,,,,
SN002551,make romantic or sexual advances overtures to an uninterested party,LX001855,,,,
SN002552,"dark ‘bujurqui’-type fish with a thick body that reaches 30cm in length and lives in lakes and dark-water <[isunaaja](isunaaja)> (‘ñejilla’) swamps, where it is often found with <[asúwaja](LX000568)>",LX001856,,,,
SN002553,open one’s legs,LX001857,,,,
SN002554,"male youth, roughly 15 to 20 years old",LX001858,,,,
SN002555,keep or hold one’s legs open,LX001859,,,,
SN002556,"for something with a roughly concave or hinged form to be opened, e.g., an opened canoe, an animal that has been gutted and spread open, or an open book",LX001859,,,,
SN002557,"open something with a concave shape or hinge-like form, e.g., a person’s legs, a canoe, the torso of an animal that one is gutting, or a book",LX001860,,,,
SN002558,"‘callana’ or traditional clay bowl, these shallow bowls ranged from some 10-20cm in diameter, and up to some 5cm in depth",LX001861,,,,
SN002559,kneecap,LX001862,,Poss.pref,,
SN002560,"hardened bodily effluvia, prototypically sleep in the eyes, but also hardened matter that emerges from pimples, certain skin cysts, and wounds",marakuja,,Poss.pref,,
SN002561,"cashew, tree species",maraniuu,,,,Use of this term is deprecated by more purist native speakers
SN002562,intestines,marasi,,Poss.pref,,
SN002563,"gut an animal or fish, cutting open its torso and removing its internal organs",LX001863,,,,
SN002564,"species of small black bee similar in appearance to <[suruku](suruku)> (‘arambasa’), and also a producer of honey, but smaller, about 0.5cm length. Unlike the latter, this bee is not particularly aggressive and typically makes its nest on branches, rather than on tree trunks",LX001864,,,,
SN002565,"frog species similar to <[muusi](muusi)> (‘hualo’), but somewhat smaller, reaching some 12cm in length, and with yellowish mottled coloring. Considered edible and especially prized for their chubby limbs, they were traditionally hunted by digging them out of their burrows, located in areas of flooded forest. Their song was traditionally believed to predict the dropping of the water level after a major rise; another traditional belief held that if the hunter swallowed his saliva while approaching one of their holes, they would notice the hunter and flee",marimuusi,,,Leptodactylus sp,
SN002566,"doubled teeth, a condition where one tooth grows in the same place as another, so that one tooth sits in front of the other",LX001865,,,,
SN002567,"type of forest demon who lures its victims by taking the form of a recently born infant who cries piteously. When an unwitting person picks up the creature to cradle it, it attacks its victim; by one account, the demon fastens onto the chest of the victim and sucks out all their blood, leaving a drained husk behind, while according to another account, it transforms into a ferocious clawed monster who devours the victim alive",LX001866,,,,
SN002568,a pair of twins,LX001867,,This term obligatorily refers to a pair of individuals; there is no conventionalized way to use this term to refer to a single individual of a pair of twins,,
SN002569,"two people, fruits, or the like that grow very close together",LX001867,,,,
SN002570,"become stiff, painful, and difficult to straighten, speaking of the joints, especially the knees, elbows, or knuckles, typically of someone suffering from arthritis or rheumatism, but also applicable to a healthy person who has been in a particular position for long enough that a joint has become stiff and painful. It was traditionally believed that inducing this condition in a person’s hands was one way that <[siimapɨ](LX002864)> (shamans) punished thieves",LX001868,,The subject of the verb denotes or indexes the affected body part(s),,
SN002571,"tie a rope or string around something, e.g., around a board that is splitting so that it does split further, or around several objects, e.g., a bundle of sticks",LX001869,,The object corresponds to the thing around which the rope or string is tied,,
SN002572,"tie together multiple stick-like objects, typically in the context of tying together bundles of firewood or manioc cuttings for carrying",LX001870,,,,
SN002573,"tie together any two slender, rigid things, e.g., two sticks, but especially the limbs of a person or animal",LX001871,,,,
SN002574,"tie one entity to another by tying a rope or cord around the latter object, e.g., tying up a canoe by tying its bow rope around the trunk of a tree on the river bank",LX001872,,,,
SN002575,"‘ichichimi negro’, species of black ant that reaches some 5mm in length and typically constructs its nests out of plant litter in the branches of trees, in the stock from which <[sɨ́ɨyɨ](LX002953)> (‘itininga’) liana grow. This ant swarms and bites those who disturb the tree they inhabit, for example, when the tree is felled to clear a garden but, unlike the similar <[aákusana masakana](LX000063)>, their bites are not especially painful",masakana,"According to oral tradition, this ant is the guardian ‘mother’ (<[imɨ́ɨni](LX000871)>) of the <[sɨ́ɨyɨ](LX002953)> liana, and it was believed that all such vines grow from the bodies of dead ants of this species. The nests of these ants were sometimes harvested as the key ingredient in a treatment for dogs intended to make them better hunters; for this treatment, the dog was tied up and the nest, from which an acidic liquid dripped, was squeezed over their upheld nose and snouts. The dog thrashed about from this, and was kept tied up and fed for three days, with especial care taken to keep it away from cooking fires. After this treatment, some of the aggressiveness of the ants, as well as their sensitivity to interlopers, were believed to have been passed to the dog",,Dolichoderus sp,
SN002576,"‘ichichimi colorado’, ant species",LX001873,,,,
SN002577,"move one’s arms in large arcs, or wave one’s arms about, either in a deliberate, goal-oriented fashion, as in swimming or in defending oneself in a fight, or relatively unconciously, such as in gesturing while speaking or flailing about while delirious with fever",LX001874,,,,
SN002578,ask for or receive gifts from multiple individuals,LX001874,,,,
SN002579,flee or run away,LX001875,,,,
SN002580,for something to be lost,LX001875,,This sense requires use of general perfective aspect <-ki>,,
SN002581,"‘mashadiño’, type of hatchet used in late 19th and early 20th century rubber-tapping work, principally to cut grooves in the bark of latex-producing trees, to tap them; later replaced by the <[raskíita](LX002603)> (‘rasgueta’), a specialized tool for this task",LX001876,,,,
SN002582,buy; pay someone for something,LX001877,,"Though ditransitive, it is unusual for both the entity bought and the person from whom it is bought to be expressed simultaneously; one of them is normally left to be recovered from context",,
SN002583,request; ask someone for something,LX001877,,"Though ditransitive, it is unusual for both the entity requested and the person from whom it is requested to be expressed simultaneously; one of them is normally left to be recovered from context",,
SN002584,receive; take something that is being offered or given by someone,LX001877,,,,
SN002585,widow,LX001878,,,,
SN002586,become a widow or widower,LX001879,,,,
SN002587,"a type of immense, legendary boa that lived in the deep spots of rivers, and was capable of causing whirlpools to suck boats under, subsequently vomiting the boat back up without its passengers, who it had devoured",LX001880,,,,
SN002588,"a straight stretch of river, or ‘estirón’, about a half day upriver of San Antonio by ‘peke peke motor’ which has back eddies near the bank on both sides. It is reported that during the early 20th century a young man who was fishing there was swallowed by a large whirlpool; and that in subsequent decades, boats passing through at night would suddenly hit something, as if they had run aground, only to find themselves in deep water; these events led people to believe that a <[másiina](LX001880)>, or legendary giant boa, lived there",LX001881,,,,
SN002589,"former oxbow lake, now dry, located about a day and a half upriver from San Antonio by ‘peke peke’ motor, on the same side of the river as the community. It is said to have been inhabited in distant times by a legendary giant boa, or <[másiina](LX001880)>, and when the lake began to dry up at some point in the 19th century, this was attributed to the <[másiina](LX001880)> having left the lake",LX001882,,,,
SN002590,"‘tamborero’, species of ‘añashua’-type fish that reaches some 30cm; it is encountered principally at the mouths of creeks and in relatively still back-eddies, especially those next to overhanging cutbanks. Its body is green, lightening to yellow around its gills, with transverse pale stripes along its length",LX001883,,,,
SN002591,species of ‘bijao’ that grows in moist soils. This plant has a tall slender stalk that reaches up to 1.5m in height and from which emerge relatively small leaves reaching 30cm in length; traditionally a fiber was extracted from these stalk and was spun into a slender cord out of which were woven decorative grips for spears,LX001884,,,Heliconia sp,
SN002592,"spread arms or hold arms open, e.g., to embrace someone",LX001885,,,,
SN002593,"type of flat sieve woven from <[tasiina](tasiina_1)>, that is to say, fiber from the <[muwaasi](muwaasi)> (‘sinamillo’) palm, used principally for straining manioc mash in the preparation of manioc beer",LX001886,,,,
SN002594,sell,LX001887,,The recipient argument is optional,,
SN002595,widower,LX001888,,,,
SN002596,"break in two, with parts remaining connected",LX001889,,,,
SN002597,"break in two, with parts remaining connected",LX001890,,,,
SN002598,"make something, protoypically a person or animal flee, run away, or go away, e.g., make game animals flee by making noise, cause a spouse leave by mistreatment; less commonly, the affected entity may be something other than a living being, e.g., an illness that is driven away from a community by the burning of certain efficacious substances",LX001891,,,,
SN002599,lose or misplace something,LX001891,,,,
SN002600,break in two (stick-like object),LX001892,,,,
SN002601,"Russet-backed Oropendola, vocal species of reddish-brown bird commonly seen near rivers, reaching 25cm in length; it has a pale and somewhat long pointed beak and long tail, with distinctive yellow feathers making a stripe on each side of the tail",masiku,,,Psarocolius angustifrons,
SN002602,raft,LX001893,,,,
SN002603,"general term for racks, typically made of four vertical supports and multiple parallel horizontal sticks on top, typically used to smoke meat or fish, or dry them in the sun, when salted",LX001893,,,,
SN002604,"a skin disease, likely erysipelas, in which raised red patches appear on the face, reminiscent of the face patches of certain species of oropendolas, <[masiku](masiku)>, from which the name derives",LX001894,,,,
SN002605,"Green Oropendola, vocal species of greenish-brown bird that reaches some 40cm in length; it has a pale and somewhat long pointed beak, tipped with red, and long tail, with distinctive yellow feathers making a stripe on each side of the tail",LX001895,,,Psaracolius viridis,
SN002606,"make raft, smoking rack, or salted fish drying rack, i.e., make an object consisting of multiple parallel sticks, poles, or trunks that are secured by cross pieces to which the former are secured",LX001896,,,,
SN002607,smoking rack for fish,LX001897,,,,
SN002608,"Swallow-tailed Kite, ‘tijera chupa’ or ‘veranero’, raptor species with a dark body, white underparts, and a striking forked tail. It is an occasional visitor in Iquito territory, generally coming in the early dry season (September-November), and it is reputed to throw hard fruits on people’s heads",LX001898,,,Elanoides forficatus,
